[{"allow_outbound":false,"created_at":"2026-10-30","data_mode":"mixed_explicit","entry":"index.html","id":"artemis-method-engine","notes":"Full Method Engine export: the Method, Case Studio, worked cases, the pipeline, the 3D agents office, the live System Map, and the Publications register. Served only by /api/sandbox/[id] behind the ADR-011 allowlisted sign-in; wrapped by /tools/artemis-method-engine. Owner-approved for allowlisted publication (ADR-011/ADR-014).","owner":"artemis-platform","resource_limits":{"max_session_seconds":3600},"source_path":"sandbox/artemis-method-engine/","title":"Artemis Method Engine","updated_at":"2026-10-30","visibility":"authenticated"}]